{
  "id": "gpt-5-6-sol-high",
  "model": "gpt-5.6-sol-high",
  "title": "GPT 5.6 Sol High",
  "isTest": false,
  "status": "complete",
  "startedAt": "2026-06-28T22:03:01.595Z",
  "updatedAt": "2026-06-29T01:58:34.057Z",
  "stages": [
    {
      "number": 1,
      "status": "complete",
      "evaluation": {
        "status": "complete",
        "score": 70.3,
        "rawScore": 70.3,
        "grade": "competent",
        "evaluatedAt": "2026-06-28T22:13:33.000Z",
        "rubricVersion": "1.0.0",
        "path": "runs/gpt-5-6-sol-high/evaluations/stage1.json",
        "categoryScores": {
          "visualFidelity": 68.8,
          "featureCompletion": 75,
          "interactionQuality": 66.3,
          "engineeringQuality": 75
        },
        "reportPath": "/reports/gpt-5-6-sol-high/index.html#stage-1"
      }
    },
    {
      "number": 2,
      "status": "complete",
      "evaluation": {
        "status": "complete",
        "score": 65.5,
        "rawScore": 65.5,
        "grade": "developing",
        "evaluatedAt": "2026-06-28T22:25:09.000Z",
        "rubricVersion": "1.0.0",
        "path": "runs/gpt-5-6-sol-high/evaluations/stage2.json",
        "categoryScores": {
          "visualFidelity": 75,
          "featureCompletion": 66.3,
          "audioQuality": 65,
          "interactionQuality": 50,
          "engineeringQuality": 62.5
        },
        "reportPath": "/reports/gpt-5-6-sol-high/index.html#stage-2"
      }
    },
    {
      "number": 3,
      "status": "complete",
      "evaluation": {
        "status": "complete",
        "score": 45.8,
        "rawScore": 45.8,
        "grade": "incomplete",
        "evaluatedAt": "2026-06-28T22:38:25.000Z",
        "rubricVersion": "1.0.0",
        "path": "runs/gpt-5-6-sol-high/evaluations/stage3.json",
        "categoryScores": {
          "visualFidelity": 62.5,
          "featureCompletion": 42.5,
          "audioQuality": 33.8,
          "systemBehavior": 53.8,
          "engineeringQuality": 50
        },
        "reportPath": "/reports/gpt-5-6-sol-high/index.html#stage-3"
      }
    }
  ],
  "evaluation": {
    "rubricVersion": "1.0.0",
    "score": 58.8,
    "grade": "incomplete",
    "evaluatedStages": [
      1,
      2,
      3
    ],
    "availableStageWeight": 100,
    "reportPath": "/reports/gpt-5-6-sol-high/index.html"
  },
  "previewPath": "/previews/gpt-5-6-sol-high/stage3/index.html",
  "previewStage": 3,
  "previews": {
    "1": "/previews/gpt-5-6-sol-high/stage1/index.html",
    "2": "/previews/gpt-5-6-sol-high/stage2/index.html",
    "3": "/previews/gpt-5-6-sol-high/stage3/index.html"
  }
}
